timestamp,language,error_type,question,path,tags
2020-10-22T18:01:54.386226Z,en
,,UnreachableQuestions,need structured products phone number,Auto Ontology,phone-numnber
,,UnreachableQuestions,mutual fund operations number,Auto Ontology,phone-number
,,UnreachableQuestions,What does 'DROPPED BY' mean?,Auto Ontology,drop
,,UnreachableQuestions,How do unsubscribe from Next Best Action (NBA) emails?,Auto Ontology,"good action,nba email"
,,UnreachableQuestions,How can I see if an invoice has been paid?,Auto Ontology,pay
,,UnreachableQuestions,when will a 1099 be sent,"Auto Ontology,form",
,,UnreachableQuestions,when will 1099r be sent,"Auto Ontology,form",
,,UnreachableQuestions,zero priced security removal,"Auto Ontology,form,worthless security",
,,UnreachableQuestions,When do W8s expire?,"Auto Ontology,form,w 8ben",
,,UnreachableQuestions,prospect in 3d,"Auto Ontology,information,profile",
,,UnreachableQuestions,where is brnach 268,"Auto Ontology,information,branch",
,,UnreachableQuestions,why acat positions were not transferred,"Auto Ontology,information,branch",
,,UnreachableQuestions,&lt;&lt; [open guide] 529 &gt;&gt;,"Auto Ontology,529 account",
,,UnreachableQuestions,when w9 required,"Auto Ontology,client,form",
,,UnreachableQuestions,when should i use the California Affidavit of Domicile,"Auto Ontology,client,form",
,,UnreachableQuestions,pdf not working,"Auto Ontology,client,view,pdf document",
,,UnreachableQuestions,add a view only role,"Auto Ontology,client,view,access",
,,UnreachableQuestions,adding view only role,"Auto Ontology,client,view,access",
,,UnreachableQuestions,add view only authority,"Auto Ontology,client,view,access",
,,UnreachableQuestions,add view only,"Auto Ontology,client,view,access",
,,UnreachableQuestions,add view only account on mso,"Auto Ontology,client,view,access",
,,UnreachableQuestions,add view only role,"Auto Ontology,client,view,access",
,,UnreachableQuestions,add a view only account,"Auto Ontology,client,view,access",
,,UnreachableQuestions,why cant i create a view only role on an utma account,"Auto Ontology,client,view,access",
,,UnreachableQuestions,performance and reinvestment,"Auto Ontology,client,portfolio",
,,UnreachableQuestions,wire set up,"Auto Ontology,client,information,wire transfer",
,,UnreachableQuestions,where do i send lal payments,"Auto Ontology,client,payment,person",
,,UnreachableQuestions,will the LAL spread update automatically when assets are added,"Auto Ontology,liquidity",
,,UnreachableQuestions,authorized individual change,"Auto Ontology,liquidity",
,,UnreachableQuestions,where can i find my lal payoff amount,"Auto Ontology,liquidity",
,,UnreachableQuestions,payment to an lal,"Auto Ontology,liquidity,loan",
,,UnreachableQuestions,Withdrawal from Voya 529,"Auto Ontology,plan",
,,UnreachableQuestions,processing death distribution,"Auto Ontology,process,order,default",
,,UnreachableQuestions,pay out of a vip to remaining members,"Auto Ontology,process,schedule",
,,UnreachableQuestions,where do i enter life insurance in gps,"Auto Ontology,process,insurance ticketing system",
,,UnreachableQuestions,100% withholding distribution,"Auto Ontology,transfer,portal","100-percent,withholding"
,,UnreachableQuestions,100 % withholding,"Auto Ontology,transfer,portal","100-percent,withholding"
,,UnreachableQuestions,wire call back,"Auto Ontology,transfer,wire trace",
,,UnreachableQuestions,who helps with entitlements,"Auto Ontology,transfer,stock",
,,UnreachableQuestions,where do i do a mutual fund trade correction,"Auto Ontology,change,trade date",
,,UnreachableQuestions,process a deceased account,"Auto Ontology,individual account",
,,UnreachableQuestions,qualified plan distributions,"Auto Ontology,distribution option",
,,UnreachableQuestions,outgoing 529 transfer,"Auto Ontology,account",
,,UnreachableQuestions,where do you enter employee relationship,"Auto Ontology,account,household",
,,UnreachableQuestions,when must a simple ira plan be opened,"Auto Ontology,account,type",
,,UnreachableQuestions,premature ira distribution,"Auto Ontology,pay,penalty",
,,UnreachableQuestions,platinum card qualification,"Auto Ontology,american express",
,,UnreachableQuestions,patriot act adfress,"Auto Ontology,address",
,,UnreachableQuestions,pat act addres,"Auto Ontology,address",
,,UnreachableQuestions,order debit card,"Auto Ontology,address",
,,UnreachableQuestions,power of attorney eauth,"Auto Ontology,client enroll",
,,UnreachableQuestions,performance report vs statements,"Auto Ontology,match",
,,UnreachableQuestions,why woulding pending activity show in 3D,"Auto Ontology,periodic review",
,,UnreachableQuestions,performance reporting statements,"Auto Ontology,date",
,,UnreachableQuestions,performance reports statements,"Auto Ontology,date",
,,UnreachableQuestions,perks at work,"Auto Ontology,pcm",
,,UnreachableQuestions,How do I place a Stop Payment on a client-issued check?,"Auto Ontology,pcm",
,,UnreachableQuestions,place stop payment,"Auto Ontology,pcm",
,,UnreachableQuestions,wire from LAL to AAA,"Auto Ontology,wire transfer",
,,UnreachableQuestions,outgoing transfer sfc,"Auto Ontology,wire transfer",
,,UnreachableQuestions,outgoing wire request,"Auto Ontology,wire transfer",
,,UnreachableQuestions,outgoing wire instructions,"Auto Ontology,wire transfer",
,,UnreachableQuestions,participating esign acat,"Auto Ontology,esign package",
,,UnreachableQuestions,pay ecl from internal account,"Auto Ontology,express",
,,UnreachableQuestions,outside poa approval,"Auto Ontology,document,approve",
,,UnreachableQuestions,where can i find a 1098,"Auto Ontology,document,form",
,,UnreachableQuestions,where can I find a gift letter,"Auto Ontology,document,form",
,,UnreachableQuestions,where can i find the patriot ac,"Auto Ontology,document,form",
,,UnreachableQuestions,where on 3d do I find the periodic review attestation,"Auto Ontology,document,form",
,,UnreachableQuestions,where to find beneficiary paperwork,"Auto Ontology,document,form",
,,UnreachableQuestions,outgoing transfer college america,"Auto Ontology,external firm",
,,UnreachableQuestions,ordering an annuity,"Auto Ontology,annuity order",
,,UnreachableQuestions,partnership; probated estate,"Auto Ontology,estate account",
,,UnreachableQuestions,paperwork for ind to trust,"Auto Ontology,account type",
,,UnreachableQuestions,outgoing foreign currency check,"Auto Ontology,check deposit",
,,UnreachableQuestions,outgoing wire limit,"Auto Ontology,external",
,,UnreachableQuestions,orders in managed accounts,"Auto Ontology,available",
,,UnreachableQuestions,workflow dashboard Unclaimed Screen is not showing all items,"Auto Ontology,view,wfd",
,,UnreachableQuestions,where can i find classification information,"Auto Ontology,view,class action",
,,UnreachableQuestions,wire fund fee,"Auto Ontology,fee,transfer,account",
,,UnreachableQuestions,Are investment earnings always net (inclusive) of fees?,"Auto Ontology,fee,investment earning",net
,,UnreachableQuestions,Will i receive a notification if i become eligibile,"Auto Ontology,value pricing",
,,UnreachableQuestions,who does bonds,"Auto Ontology,coupon payment",
,,UnreachableQuestions,who do I call for this 529 distribution,"Auto Ontology,service",
,,UnreachableQuestions,where is investor insights,"Auto Ontology,copy,distribution list",
,,UnreachableQuestions,where do i go to approval and increase for mobile deposits,"Auto Ontology,limit",
,,UnreachableQuestions,where can I find information on liquidity funds,"Auto Ontology,liquidation",
,,UnreachableQuestions,when will a specific account fee,"Auto Ontology,advisory fee",
,,UnreachableQuestions,when will a client get reserve status,"Auto Ontology,household",
,,UnreachableQuestions,when is a wire fee charged,"Auto Ontology,termination",
,,UnreachableQuestions,when does a pin number expire for eisgn,"Auto Ontology,esign",
,,UnreachableQuestions,What is my client's Reserved email address?,"Auto Ontology,email address","client s,reserve"
,,UnreachableQuestions,What can a client's available funds be used for?,"Auto Ontology,available fund","use,client s"
,,UnreachableQuestions,How do I view my client's foreign transaction fees?,"Auto Ontology,foreign transaction fee","client s,view"
,,UnreachableQuestions,Why is my client's check order still pending?,"Auto Ontology,check order","client s,pende"
,,QuestionsAtRoot,how to open a sub accunt,,
,,QuestionsAtRoot,open held away 401k,,
,,QuestionsAtRoot,open a hard dollar account,,
,,QuestionsAtRoot,open limited partnership account,,
,,QuestionsAtRoot,open an account for a green card,,
,,QuestionsAtRoot,how to open a principle simple ira,,
,,QuestionsAtRoot,new account open,,
,,QuestionsAtRoot,patriot act entity verification,,
,,QuestionsAtRoot,paloma share class,,
,,QuestionsAtRoot,pat act entity trust rejection,,
,,QuestionsAtRoot,workflow does not read vda,,
,,QuestionsAtRoot,Where can I find my client's fee,,
,,QuestionsAtRoot,when will checking account generate,,
,,QuestionsAtRoot,What is free riding?,,
,,QuestionsAtRoot,Who are the most vulnerable taxpayers?,,
